{
  "$schema": "https://json-schema.org/draft/2020-12/schema",
  "$id": "https://github.com/mmkdigitalio/hackathon-platform-team/platform/schemas/foundation-outputs/foundation-outputs.schema.json",
  "title": "Foundation output contract",
  "description": "Stack outputs of organization/foundation/<env>. Schema v0 for contractVersion 1. Adding outputs is compatible; renaming or removing one requires a new contractVersion. Properties marked x-secret are Pulumi secrets and must be masked by every consumer.",
  "type": "object",
  "required": [
    "contractVersion",
    "environment",
    "location",
    "resourceGroupName",
    "baseDomain",
    "ingressIp",
    "aksClusterName",
    "kubeconfig",
    "acrLoginServer",
    "acrUsername",
    "acrPassword",
    "appInsightsConnectionString",
    "actionGroupIntakeId",
    "actionGroupHumansId",
    "operationsApiHost",
    "postgresHost",
    "postgresAdminUser",
    "postgresAdminPassword",
    "postgresOperationsDatabase",
    "diagnosticsStorageAccount",
    "diagnosticsContainer",
    "diagnosticsStorageKey",
    "alertWebhookKey",
    "maintenanceApiKey",
    "githubWebhookSecret",
    "modelApiKeys",
    "opsGithubToken",
    "ingressClassName",
    "clusterIssuerName",
    "publicScheme"
  ],
  "properties": {
    "contractVersion": { "const": 1, "description": "Incremented on every incompatible change." },
    "environment": { "enum": ["staging", "production"] },
    "location": { "type": "string", "minLength": 1, "description": "Azure region of the platform resources." },
    "resourceGroupName": { "type": "string", "pattern": "^rg-mmk-platform-(staging|production)$" },
    "baseDomain": {
      "type": "string",
      "pattern": "^[0-9]{1,3}(-[0-9]{1,3}){3}\\.sslip\\.io$",
      "description": "<ingress-ip-with-dashes>.sslip.io; apps are served at <app-id>.<baseDomain>."
    },
    "ingressIp": { "type": "string", "format": "ipv4", "description": "Public IP of the shared ingress controller." },
    "aksClusterName": { "type": "string", "minLength": 1 },
    "kubeconfig": { "type": "string", "x-secret": true, "description": "Admin kubeconfig (local accounts); full cluster access." },
    "acrLoginServer": { "type": "string", "pattern": "\\.azurecr\\.io$" },
    "acrUsername": { "type": "string", "minLength": 1, "description": "ACR admin user; app stacks build image pull secrets from it." },
    "acrPassword": { "type": "string", "x-secret": true },
    "appInsightsConnectionString": { "type": "string", "minLength": 1 },
    "actionGroupIntakeId": { "type": "string", "pattern": "^/subscriptions/", "description": "Action group ops-intake (webhook to the event intake)." },
    "actionGroupHumansId": { "type": "string", "pattern": "^/subscriptions/", "description": "Action group ops-humans (e-mail only)." },
    "operationsApiHost": { "type": "string", "pattern": "^operations-agent\\.", "description": "Host under which the agent release publishes its API: operations-agent.<baseDomain>." },
    "postgresHost": { "type": "string", "minLength": 1 },
    "postgresAdminUser": { "type": "string", "minLength": 1 },
    "postgresAdminPassword": { "type": "string", "x-secret": true },
    "postgresOperationsDatabase": { "const": "operations" },
    "diagnosticsStorageAccount": { "type": "string", "pattern": "^[a-z0-9]{3,24}$" },
    "diagnosticsContainer": { "const": "diagnostics" },
    "diagnosticsStorageKey": { "type": "string", "x-secret": true },
    "alertWebhookKey": { "type": "string", "x-secret": true, "description": "Query parameter key of the Azure Monitor webhook." },
    "maintenanceApiKey": { "type": "string", "x-secret": true, "description": "Value of the X-Api-Key header of the maintenance intake." },
    "githubWebhookSecret": { "type": "string", "x-secret": true, "description": "Signing secret of the GitHub issue webhook." },
    "modelApiKeys": {
      "type": "object",
      "x-secret": true,
      "description": "Model API keys by provider, e.g. anthropic or azure-openai.",
      "minProperties": 1,
      "additionalProperties": { "type": "string", "minLength": 1 }
    },
    "opsGithubToken": { "type": "string", "x-secret": true, "description": "Fine-grained PAT of the agent." },
    "ingressClassName": { "type": "string", "minLength": 1, "description": "Addition: IngressClass for app Ingress rules." },
    "clusterIssuerName": { "type": "string", "minLength": 1, "description": "Addition: cert-manager ClusterIssuer (Let's Encrypt, HTTP-01) for app Ingress rules." },
    "publicScheme": {
      "enum": ["https", "http"],
      "description": "Addition: scheme of availability tests and the ops-intake webhook; http only while the documented Let's Encrypt fallback is active."
    },
    "platformVersions": {
      "type": "object",
      "description": "Addition, optional: component versions configured for the last foundation run (Kubernetes, Traefik and cert-manager charts, PostgreSQL) for run summaries and upgrade notes.",
      "required": ["kubernetes", "traefikChart", "certManagerChart", "postgres"],
      "properties": {
        "kubernetes": { "type": "string", "minLength": 1 },
        "traefikChart": { "type": "string", "minLength": 1 },
        "certManagerChart": { "type": "string", "minLength": 1 },
        "postgres": { "type": "string", "minLength": 1 }
      },
      "additionalProperties": { "type": "string", "minLength": 1 }
    }
  },
  "additionalProperties": true
}
