{
  "contractVersion": 1,
  "environment": "staging",
  "location": "germanywestcentral",
  "resourceGroupName": "rg-mmk-platform-staging",
  "baseDomain": "203-0-113-10.sslip.io",
  "ingressIp": "203.0.113.10",
  "aksClusterName": "aks-mmk-platform-staging",
  "kubeconfig": "<secret>",
  "acrLoginServer": "acrmmkplatformstagingab12cd.azurecr.io",
  "acrUsername": "acrmmkplatformstagingab12cd",
  "acrPassword": "<secret>",
  "appInsightsConnectionString": "InstrumentationKey=33333333-3333-3333-3333-333333333333;IngestionEndpoint=https://germanywestcentral-1.in.applicationinsights.azure.com/",
  "actionGroupIntakeId": "/subscriptions/00000000-0000-0000-0000-000000000000/resourceGroups/rg-mmk-platform-staging/providers/Microsoft.Insights/actionGroups/ops-intake",
  "actionGroupHumansId": "/subscriptions/00000000-0000-0000-0000-000000000000/resourceGroups/rg-mmk-platform-staging/providers/Microsoft.Insights/actionGroups/ops-humans",
  "operationsApiHost": "operations-agent.203-0-113-10.sslip.io",
  "postgresHost": "psql-mmk-platform-staging-ab12cd.postgres.database.azure.com",
  "postgresAdminUser": "opsadmin",
  "postgresAdminPassword": "<secret>",
  "postgresOperationsDatabase": "operations",
  "diagnosticsStorageAccount": "stmmkdiagab12cd",
  "diagnosticsContainer": "diagnostics",
  "diagnosticsStorageKey": "<secret>",
  "alertWebhookKey": "<secret>",
  "maintenanceApiKey": "<secret>",
  "githubWebhookSecret": "<secret>",
  "modelApiKeys": {
    "anthropic": "<secret>"
  },
  "opsGithubToken": "<secret>",
  "ingressClassName": "traefik",
  "clusterIssuerName": "letsencrypt",
  "publicScheme": "https"
}
